{
  "schema_version": 1, "minimum_reader_version": "0.4.0", "project_id": "project-p", "provider": "opencode", "session_id": "session-1", "generation_id": "generation-1", "session_view_digest": "sha256:1111111111111111111111111111111111111111111111111111111111111111",
  "phase_boundaries": { "total": 0, "shown": 0, "omitted": 0, "coverage": { "seen": 0, "indexed": 0, "collapsed": 0, "unprojected": 0, "undecodable": 0, "truncated": 0 }, "items": [] }, "key_operations": { "total": 0, "shown": 0, "omitted": 0, "coverage": { "seen": 0, "indexed": 0, "collapsed": 0, "unprojected": 0, "undecodable": 0, "truncated": 0 }, "items": [] }, "verification_results": { "total": 0, "shown": 0, "omitted": 0, "coverage": { "seen": 0, "indexed": 0, "collapsed": 0, "unprojected": 0, "undecodable": 0, "truncated": 0 }, "items": [] }, "errors": { "total": 0, "shown": 0, "omitted": 0, "coverage": { "seen": 0, "indexed": 0, "collapsed": 0, "unprojected": 0, "undecodable": 0, "truncated": 0 }, "items": [] }, "unresolved_questions": { "total": 0, "shown": 0, "omitted": 0, "coverage": { "seen": 0, "indexed": 0, "collapsed": 0, "unprojected": 0, "undecodable": 0, "truncated": 0 }, "items": [] },
  "rules": { "rule_id": "summary-rules", "rule_version": "v1", "dependency_digests": [] }, "coverage": { "seen": 0, "indexed": 0, "collapsed": 0, "unprojected": 0, "undecodable": 0, "truncated": 0 }
}
